<?xml version="1.0" encoding="UTF-8"?>
<!ELEMENT descripcion (#PCDATA)>
<!ELEMENT fecha EMPTY>
<!ELEMENT hecho (descripcion, fecha)>
<!ELEMENT tabla (hecho+)>
<!ATTLIST fecha dia CDATA #REQUIRED
                mes CDATA #REQUIRED
                anyo CDATA #REQUIRED>
